{"role":"implementer","unit":"m28-gitsync-konsumenci","packetBytes":124951,"portions":[{"name":"m28-gitsync-konsumenci/p1-l2-l5","layers":["L2","L4","L5"],"slugs":["release","release-push-response","ac-commitforrelease-i-push-honoruja-master","ac-przy-detached-head-lub-unborn-branch-d","ac-przy-config-git-syncpushonpush-false","ac-rest-patch-api-releases-nameorid-z-bod","ac-wynik-gitsync-inny-niz-status-error-c"]}],"deviations":[]}
