{"role":"implementer","unit":"m05-always-excluded","packetBytes":63254,"portions":[{"name":"m05-always-excluded/p1-l5-l17","layers":["L5","L17"],"slugs":["ac-element-always-excluded-na-karcie-age","ac-ekran-m26-directories-blokuje-przycisk","ac-lista-elementu-roots-na-karcie-direct"]}],"deviations":[]}
