{
  "role": "implementer",
  "unit": "u03-editor-command-sources",
  "packetBytes": 92762,
  "portions": [
    {
      "name": "u03-editor-command-sources/p1-l5-l13",
      "layers": ["L5", "L8", "L13"],
      "slugs": [
        "editor-context-spec",
        "wklad-do-edytora-m05",
        "wklad-do-edytora-m20",
        "ac-chat-input-minimalna-instancja-tiptap",
        "m14-composer-pageref-serializacja-at",
        "m20-composer-slash-popover",
        "m20-zrodlo-komend-blad-odczytu",
        "m20-zrodlo-komend-kolizja-hint",
        "m20-zrodlo-komend-poza-whitelista",
        "m20-zrodlo-komend-pull-przy-otwarciu",
        "m05-znacznik-slug-bez-type-bez-renderu"
      ]
    }
  ],
  "deviations": []
}
