{
  "role": "implementer",
  "unit": "m13-detail-scaffold",
  "packetBytes": 70671,
  "portions": [
    {
      "name": "m13-detail-scaffold/p1-l12",
      "layers": ["L12"],
      "slugs": [
        "m13l12sc",
        "detail-panel-shell",
        "document-body",
        "field-grid",
        "field-row",
        "ac-detailpanelshell-renderuje-ostatni-cz",
        "ac-documentbody-kontrybuowany-przez-m13-e",
        "ac-fieldgrid-uklada-w-kolumne-wiersze-fi",
        "ac-fieldrow-renderuje-jeden-wiersz-pary"
      ]
    }
  ],
  "deviations": []
}
