{
  "role": "implementer",
  "unit": "kit-catalog-m34",
  "packetBytes": 170244,
  "portions": [
    {
      "name": "kit-catalog-m34/p1-l11-l12",
      "layers": ["L11", "L12"],
      "slugs": [
        "ac-autor-bierze-tier-experimental-za-bra",
        "ac-overlay-czatu-m05-i-powierzchnia-edyto",
        "m34-requires-m13",
        "m34-requires-m20",
        "moduly-feature",
        "warstwy",
        "sub-drzewo-m34"
      ]
    }
  ],
  "deviations": []
}
