{"role": "implementer", "unit": "u12-git-clone", "packetBytes": 86223, "portions": [{"name": "u12-git-clone/p1-l13-l17", "layers": ["L13", "L17"], "slugs": ["ac-bootstrap-tworzy-aktualizuje-gitignore", "ac-clone-restore-odtwarza-wszystkie-releasa", "ac-git-commit-przy-createrelease-obejmuje-w", "ac-katalogi-artefaktow-briefsdir-patche", "ac-przy-w-czonym-config-git-synccommitonre", "section:dj6r1sam", "section:eu1rffp6", "section:mm4bidri", "section:aqys9dje", "section:2qwi21mw", "section:yn1oesly", "section:1svflc6b", "section:m28aug01", "section:m28l13rt", "section:fxcropku", "section:64bmqf81", "section:m27l13rt"]}]}
