{"role": "implementer", "unit": "u11-config-settings", "packetBytes": 125697, "portions": [{"name": "u11-config-settings/p1-l2-l17", "layers": ["L2", "L13", "L17"], "slugs": ["ac-config-json-z-kluczem-dir-dla-planow", "ac-ekran-m26-directories-blokuje-przycisk", "ac-konfiguracja-ktorej-roots-nie-ma-dokl", "ac-korzen-uzytkownika-o-identyfikatorze", "ac-korzen-uzytkownika-z-dir-przechodzi-w", "ac-korzen-uzytkownika-z-dir-rownym-claud", "ac-lista-elementu-roots-na-karcie-direct", "ac-przy-config-json-z-kluczem-dir-dla-pl", "ac-swiezy-bootstrap-nie-zapisuje-w-confi", "ac-swiezy-bootstrap-tworzy-katalogi-wszy", "ac-wpis-roots-z-polem-spoza-id-name-dir", "ac-continue-z-agent-conversationallangua", "ac-continue-z-waznym-formularzem-wysyla", "ac-continue-ze-zmienionym-dir-builtin-ro", "ac-drugie-przemianowanie-w-tym-samym-pro", "ac-m26-sekcja-agent-settings-zawiera-d", "ac-m26-sekcja-project-settings-zawiera-2", "ac-odczyt-konfiguracji-po-swiezym-bootst", "ac-odmowa-przemianowania-na-continue-zos", "ac-po-domknieciu-onboardingu-odczyt-konf", "ac-po-przemianowaniu-przestrzeni-podstaw", "ac-pola-agent-allowedpaths-agent-disallowed", "ac-ponowne-zatwierdzenie-juz-zakonczoneg", "ac-projekt-sprzed-m16-ktorego-config-nie", "ac-przemianowanie-przerwane-restartem-pr", "ac-przemianowanie-przestrzeni-zostawia-j", "ac-przemianowanie-rootu-zatwierdzone-z-t", "ac-skip-nie-wysyla-roots-dir-builtin-roo", "ac-skip-otwiera-confirmmodal-a-po-potwie", "ac-textarea-allowed-disallowed-paths-sekcj", "ac-w-sekcji-advanced-onboardingu-mozna-z", "config-json-shape", "app-config-response", "patch-config-request", "rename-root-response", "post-api-config-roots-rootid-rename", "section:c0nf1g4a", "section:dklcl4nf", "section:cfg0gitw", "section:dsh8ezbz", "section:t4rxgh31", "section:kt5gesnm", "section:m26stsec", "section:m01l13rt", "section:m01rootsval", "section:3zqke46q", "section:ournm78e"]}]}